TAIR Accession	Locus	Gene Type	Description	Other Name(Type)	Keywords
Locus:2205190	AT1G08090	protein_coding	High-affinity nitrate transporter. Up-regulated by nitrate. Functions as a repressor of lateral root initiation independently of nitrate uptake.	ACH1;ATNRT2.1;ATNRT2:1;LATERAL ROOT INITIATION 1;LIN1;NITRATE TRANSPORTER 2;NITRATE TRANSPORTER 2.1;NITRATE TRANSPORTER 2:1;NRT2;NRT2.1;NRT2:1;NRT2;1AT;nitrate transporter 2:1	lateral root development;nitrate transmembrane transport;response to nitrate;cellular response to nitrate;nitrate transmembrane transport;plasma membrane;membrane;plasma membrane;nitrate transmembrane transporter activity;guard cell;root;shoot system,
Locus:2010391	AT1G12940	protein_coding	member of High affinity nitrate transporter family	ATNRT2.5;NRT2.5;nitrate transporter2.5	biological_process;cytoplasm;nitrate transmembrane transporter activity;guard cell;inflorescence meristem;stem,
Locus:2205195	AT1G08100	protein_coding	Encodes a high-affinity nitrate transporter.	ATNRT2.2;NITRATE TRANSPORTER 2.2;NRT2.2;NRT2;2AT	lateral root development;nitrate transmembrane transport;cellular response to nitrate;nitrate transmembrane transport;plasma membrane;plasma membrane;nitrate transmembrane transporter activity,
Locus:2119058	AT4G21680	protein_coding	Encodes a nitrate transporter (NRT1.8).  Functions in nitrate removal from the xylem sap. Mediates cadmium tolerance.	ATNPF7.2;NITRATE TRANSPORTER 1.8;NPF7.2;NRT1.8;NRT1/ PTR FAMILY 7.2	response to cadmium ion;response to nitrate;transmembrane transport;membrane;nucleus;plasma membrane;nitrate transmembrane transporter activity;transmembrane transporter activity;LP.04 four leaves visible stage;flowering stage;petal differentiation and expansion stage;cotyledon;flower;guard cell;hypocotyl;parenchyma;pollen;root;shoot apex;vascular leaf;xylem,
Locus:2035005	AT1G18880	protein_coding	Encodes a low-af&#64257;nity plasma membrane nitrate transporter expressed in the companion cells of root phloem.	ATNPF2.9;GTR3;NPF2.9;NRT1.9;NRT1/ PTR FAMILY 2.9;nitrate transporter 1.9	phloem nitrate loading;phloem transport;glucosinolate transport;transmembrane transport;plasma membrane;plasma membrane;nitrate transmembrane transporter activity;transmembrane transporter activity;LP.02 two leaves visible stage;LP.04 four leaves visible stage;LP.06 six leaves visible stage;LP.08 eight leaves visible stage;LP.10 ten leaves visible stage;LP.12 twelve leaves visible stage;flowering stage;mature plant embryo stage;petal differentiation and expansion stage;plant embryo bilateral stage;plant embryo cotyledonary stage;plant embryo globular stage;vascular leaf senescent stage;carpel;cauline leaf;collective leaf structure;companion cell;cotyledon;flower;flower pedicel;guard cell;hypocotyl;inflorescence meristem;leaf apex;leaf lamina base;petal;petiole;plant embryo;pollen;root;seed;sepal;shoot apex;shoot system;stamen;stem;vascular leaf;root vascular system,
Locus:2157737	AT5G50200	protein_coding	Wound-responsive gene 3 (WR3).  Encodes a high-affinity nitrate transporter. Up-regulated by nitrate. Involved in jasmonic acid-independent wound signal transduction.	ATNRT3.1;NITRATE TRANSPORTER 3.1;NRT3.1;WOUND-RESPONSIVE 3;WR3	nitrate transmembrane transport;response to nitrate;response to wounding;response to nitrate;plasma membrane;nitrate transmembrane transporter activity;LP.02 two leaves visible stage;LP.04 four leaves visible stage;LP.06 six leaves visible stage;LP.08 eight leaves visible stage;LP.10 ten leaves visible stage;LP.12 twelve leaves visible stage;flowering stage;petal differentiation and expansion stage;plant embryo globular stage;vascular leaf senescent stage;cauline leaf;collective leaf structure;cotyledon;cultured plant cell;flower;flower pedicel;guard cell;hypocotyl;inflorescence meristem;leaf apex;leaf lamina base;petal;petiole;plant embryo;root;sepal;shoot apex;shoot system;stamen;stem;vascular leaf,
Locus:2093442	AT3G16180	protein_coding	Encodes a low affinity nitrate transporter that is expressed in the plasma membrane and found in the phloem of the major veins of leaves.  It is responsible for nitrate redistribution to young leaves.	NITRATE TRANSPORTER 1.12;NRT1.12	nitrate transmembrane transport;transmembrane transport;plasma membrane;low-affinity nitrate transmembrane transporter activity;transmembrane transporter activity;LP.02 two leaves visible stage;LP.04 four leaves visible stage;LP.06 six leaves visible stage;LP.08 eight leaves visible stage;LP.10 ten leaves visible stage;LP.12 twelve leaves visible stage;flowering stage;mature plant embryo stage;petal differentiation and expansion stage;plant embryo bilateral stage;plant embryo cotyledonary stage;plant embryo globular stage;vascular leaf senescent stage;carpel;cauline leaf;collective leaf structure;cotyledon;flower;flower pedicel;guard cell;hypocotyl;inflorescence meristem;leaf apex;leaf lamina base;petal;petiole;phloem;plant embryo;pollen;primary leaf vein;root;seed;sepal;shoot apex;shoot system;stamen;stem;vascular leaf,
Locus:2196800	AT1G69870	protein_coding	Encodes a low affinity nitrate transporter NRT1.7.  Expressed in phloem.  Responsible for source-to-sink remobilization of nitrate. The mRNA is cell-to-cell mobile.	ATNPF2.13;NITRATE TRANSPORTER 1.7;NPF2.13;NRT1.7;NRT1/ PTR FAMILY 2.13	nitrate transmembrane transport;transmembrane transport;plasma membrane;chloroplast;plasma membrane;low-affinity nitrate transmembrane transporter activity;transmembrane transporter activity;LP.02 two leaves visible stage;LP.04 four leaves visible stage;LP.06 six leaves visible stage;LP.08 eight leaves visible stage;LP.10 ten leaves visible stage;LP.12 twelve leaves visible stage;flowering stage;mature plant embryo stage;petal differentiation and expansion stage;plant embryo bilateral stage;plant embryo cotyledonary stage;plant embryo globular stage;vascular leaf senescent stage;carpel;cauline leaf;collective leaf structure;cotyledon;flower;flower pedicel;guard cell;hypocotyl;inflorescence meristem;leaf apex;leaf lamina base;petal;petiole;phloem;plant embryo;pollen;root;seed;sepal;shoot apex;shoot system;stamen;stem;vascular leaf;cell-to-cell mobile RNA,
Locus:2037452	AT1G52190	protein_coding	Encodes a low affinity nitrate transporter that is expressed in the plasma membrane and found in the phloem of the major veins of leaves.  It is responsible for nitrate redistribution to young leaves.	ATNPF1.2;NITRATE TRANSPORTER 1.11;NPF1.2;NRT1.11;NRT1/ PTR FAMILY 1.2	nitrate transmembrane transport;transmembrane transport;plasma membrane;nucleus;low-affinity nitrate transmembrane transporter activity;transmembrane transporter activity;LP.02 two leaves visible stage;LP.04 four leaves visible stage;LP.06 six leaves visible stage;LP.08 eight leaves visible stage;LP.10 ten leaves visible stage;LP.12 twelve leaves visible stage;flowering stage;mature plant embryo stage;petal differentiation and expansion stage;plant embryo bilateral stage;plant embryo cotyledonary stage;plant embryo globular stage;vascular leaf senescent stage;carpel;cauline leaf;collective leaf structure;cotyledon;flower;flower pedicel;guard cell;hypocotyl;inflorescence meristem;leaf apex;leaf lamina base;petal;petiole;phloem;plant embryo;pollen;primary leaf vein;root;rosette leaf;seed;sepal;shoot apex;shoot system;stamen;stem;vascular leaf,
Locus:2033776	AT1G32450	protein_coding	Transmembrane nitrate transporter. Involved in xylem transport of nitrate from root to shoot. Induced in response to high and low concentrations of nitrate. Not involved in nitrate uptake. Expressed in root pericycle cells under the control of MYB59. Also functions as a proton-coupled H+/K+ antiporter for K+ loading into the xylem.	ATNPF7.3;NITRATE TRANSPORTER 1.5;NPF7.3;NRT1.5;NRT1/ PTR FAMILY 7.3	leaf senescence;nitrate transmembrane transport;potassium ion homeostasis;proton transmembrane transport;response to nitrate;transmembrane transport;nitrate assimilation;membrane;nucleus;plasma membrane;nitrate transmembrane transporter activity;potassium:proton antiporter activity;transmembrane transporter activity;LP.04 four leaves visible stage;LP.06 six leaves visible stage;flowering stage;petal differentiation and expansion stage;vascular leaf senescent stage;carpel;cauline leaf;collective leaf structure;cotyledon;flower;guard cell;hypocotyl;inflorescence meristem;pericycle;petal;pollen;root;rosette leaf;sepal;shoot system;stamen;stem;vascular leaf;shoot system,
Locus:2205719	AT1G27080	protein_coding	Encodes a protein with low-affinity nitrate transporter activity that is expressed in the vascular tissue of the funiculus and the silique. This plasma membrane-localized enzyme is predicted to have 12 transmembrane domains. Plants lacking NRT1.6 have reduced levels of nitrate in their seeds and have increased levels of early embryonic developmental defects and seed abortion.	ATNPF2.12;NITRATE TRANSPORTER 1.6;NPF2.12;NRT1.6;NRT1/ PTR FAMILY 2.12	cellular response to nitrogen levels;embryo development ending in seed dormancy;nitrate transmembrane transport;seed development;suspensor development;transmembrane transport;plasma membrane;plasma membrane;low-affinity nitrate transmembrane transporter activity;transmembrane transporter activity;LP.04 four leaves visible stage;LP.06 six leaves visible stage;flowering stage;petal differentiation and expansion stage;plant embryo bilateral stage;plant embryo cotyledonary stage;plant embryo globular stage;carpel;cauline leaf;collective leaf structure;cotyledon;flower;flower pedicel;fruit;fruit vascular system;funicle;inflorescence meristem;leaf lamina base;petal;plant embryo;pollen;root;seed;sepal;shoot apex;stem;vascular leaf,
Locus:2041125	AT2G02040	protein_coding	Encodes a di- and tri-peptide transporter that recognizes a variety of different amino acid combinations. Expression of the transcripts for this gene can be detected in the embryo through in situ hybridization. This protein does not have nitrate transporter activity based on oocyte transport assays. Enhances water uptake duringearly seed germination.	ARABIDOPSIS THALIANA PEPTIDE TRANSPORTER 2;ATNPF8.3;ATPTR2;ATPTR2-B;NITRATE TRANSPORTER 1;NPF8.3;NRT1/ PTR FAMILY 8.3;NTR1;PEPTIDE TRANSPORTER 2;PTR2;PTR2-B	dipeptide transport;peptide transport;tripeptide transport;transmembrane transport;plant-type vacuole membrane;Golgi apparatus;plant-type vacuole;plant-type vacuole membrane;vacuolar membrane;vacuole;high-affinity oligopeptide transmembrane transporter activity;peptide transmembrane transporter activity;transmembrane transporter activity;tripeptide transmembrane transporter activity;nitrate transmembrane transporter activity;LP.02 two leaves visible stage;LP.04 four leaves visible stage;LP.06 six leaves visible stage;LP.08 eight leaves visible stage;LP.10 ten leaves visible stage;LP.12 twelve leaves visible stage;flowering stage;mature plant embryo stage;petal differentiation and expansion stage;plant embryo bilateral stage;plant embryo cotyledonary stage;plant embryo globular stage;vascular leaf senescent stage;carpel;cauline leaf;collective leaf structure;cotyledon;cultured plant cell;flower;flower pedicel;guard cell;hypocotyl;inflorescence meristem;leaf apex;leaf lamina base;petal;petiole;plant callus;plant embryo;pollen;root;seed;sepal;shoot apex;shoot system;stamen;stem;vascular leaf,
Locus:6532567110	AT4G24715	protein_coding	Gene structure was modified for Araport11. This is the new structure for NRT3.2	NITRATE TRANSPORTER 3.2;NRT3.2	biological_process;cellular_component;molecular_function,
Locus:2196739	AT1G69850	protein_coding	Encodes an inducible component of low-affinity nitrate uptake. mRNA found primarily in root hairs and the epidermis of roots.  It also acts as an ABA importer at the site of ABA biosynthesis and is important for the regulation of stomatal aperture in inflorescence stems.	ABA-IMPORTING TRANSPORTER 1;AIT1;ATNPF4.6;ATNRT1:2;NPF4.6;NRT1.2;NRT1/ PTR FAMILY 4.6;NRT1:2;NTL1;nitrate transporter 1:2	abscisic acid transport;regulation of stomatal movement;response to nematode;transmembrane transport;membrane;nucleus;plasma membrane;abscisic acid transmembrane transporter activity;protein binding;transmembrane transporter activity;LP.02 two leaves visible stage;LP.04 four leaves visible stage;LP.06 six leaves visible stage;LP.08 eight leaves visible stage;LP.10 ten leaves visible stage;LP.12 twelve leaves visible stage;flowering stage;mature plant embryo stage;petal differentiation and expansion stage;plant embryo bilateral stage;plant embryo cotyledonary stage;plant embryo globular stage;vascular leaf senescent stage;carpel;cauline leaf;collective leaf structure;cotyledon;flower;flower pedicel;guard cell;hypocotyl;inflorescence meristem;leaf apex;leaf lamina base;petal;petiole;plant embryo;pollen;root;seed;sepal;shoot apex;shoot system;stamen;stem;vascular leaf,
Locus:2222652	AT5G14570	protein_coding	Encodes ATNRT2.7; a nitrate transporter that controls nitrate content in seeds.  Expression is detected in reproductive organs and peaks in seeds.  Localized to the vacuolar membrane.	ATNRT2.7;NRT2.7;high affinity nitrate transporter 2.7	nitrate transmembrane transport;nucleus;plant-type vacuole membrane;nitrate transmembrane transporter activity;LP.02 two leaves visible stage;LP.04 four leaves visible stage;LP.06 six leaves visible stage;LP.08 eight leaves visible stage;LP.10 ten leaves visible stage;LP.12 twelve leaves visible stage;flowering stage;mature plant embryo stage;petal differentiation and expansion stage;plant embryo bilateral stage;plant embryo cotyledonary stage;plant embryo globular stage;vascular leaf senescent stage;carpel;cauline leaf;collective leaf structure;cotyledon;flower;flower pedicel;guard cell;hypocotyl;inflorescence meristem;leaf apex;leaf lamina base;petal;petiole;plant embryo;pollen;seed;sepal;shoot apex;shoot system;stamen;stem;vascular leaf,
Locus:2159280	AT5G60770	protein_coding	member of High affinity nitrate transporter family	ARABIDOPSIS THALIANA NITRATE TRANSPORTER 2.4;ATNRT2.4;NITRATE TRANSPORTER 2.4;NRT2.4	cellular response to nitrate;nitrate transmembrane transport;cellular response to nitrate;nitrate transmembrane transport;plasma membrane;plasma membrane;nitrate transmembrane transporter activity,
Locus:2159290	AT5G60780	protein_coding	member of High affinity nitrate transporter family	ARABIDOPSIS THALIANA NITRATE TRANSPORTER 2.3;ATNRT2.3;NITRATE TRANSPORTER 2.3;NRT2.3	cellular response to nitrate;nitrate transmembrane transport;plasma membrane;plasma membrane;nitrate transmembrane transporter activity;shoot apex;vascular leaf,
Locus:2008855	AT1G12110	protein_coding	Encodes NRT1.1 (CHL1); a dual-affinity nitrate transporter. The protein is expressed in guard cells and function in stomatal opening. Mutants have less transpiration and are more tolerant to drought. Expressed in lateral roots. Involved in nitrate signaling which enables the plant root system to detect and exploit nitrate-rich soil patches. Comparing to the wild type, the mutant displays a strongly decreased lateral root proliferation phenotype in nitrate rich patches on growth medium. Affects flowering time via interaction with the FLC dependent flowering pathway to influence its target gene FT.	ARABIDOPSIS THALIANA NITRATE TRANSPORTER 1;ATNPF6.3;ATNRT1;B-1;CHL1;CHL1-1;CHLORINA 1;NITRATE TRANSPORTER 1;NITRATE TRANSPORTER 1.1;NPF6.3;NRT1;NRT1.1;NRT1/ PTR FAMILY 6.3	basipetal auxin transport;lateral root development;nitrate transmembrane transport;photoperiodism, flowering;response to nitrate;response to water deprivation;response to nitrate;transmembrane transport;membrane;plasma membrane;nitrate transmembrane transporter activity;protein binding;LP.02 two leaves visible stage;LP.04 four leaves visible stage;LP.06 six leaves visible stage;LP.08 eight leaves visible stage;LP.10 ten leaves visible stage;LP.12 twelve leaves visible stage;flowering stage;petal differentiation and expansion stage;plant embryo bilateral stage;plant embryo cotyledonary stage;plant embryo globular stage;seed dormant stage;vascular leaf senescent stage;carpel;cauline leaf;collective leaf structure;cotyledon;flower;flower pedicel;guard cell;hypocotyl;inflorescence meristem;lateral root primordium;lateral root tip;leaf apex;leaf lamina base;petal;petiole;plant embryo;pollen;primary root tip;root;sepal;shoot apex;shoot system;stamen;stem;vascular leaf;guard cell;lateral root,
Locus:2075909	AT3G45060	protein_coding	member of High affinity nitrate transporter family	ARABIDOPSIS THALIANA HIGH AFFINITY NITRATE TRANSPORTER 2.6;ATNRT2.6;HIGH AFFINITY NITRATE TRANSPORTER 2.6;NRT2.6	cellular response to nitrate;nitrate transmembrane transport;plasma membrane;nitrate transmembrane transporter activity;petal differentiation and expansion stage;flower;guard cell;root;sepal,
Locus:4515103394	AT4G14358	protein_coding	high affinity nitrate transporter;(source:Araport11)	N/A	biological_process;cellular_component;guard cell,
Locus:2170673	AT5G62720	protein_coding	Integral membrane HPP family protein. Putative nitrate transporter.	ATNITR2;1	nitrate transmembrane transport;chloroplast;chloroplast envelope;chloroplast inner membrane;nitrate transmembrane transporter activity;LP.02 two leaves visible stage;LP.04 four leaves visible stage;LP.06 six leaves visible stage;LP.08 eight leaves visible stage;LP.10 ten leaves visible stage;LP.12 twelve leaves visible stage;flowering stage;mature plant embryo stage;petal differentiation and expansion stage;plant embryo bilateral stage;plant embryo cotyledonary stage;plant embryo globular stage;vascular leaf senescent stage;carpel;cauline leaf;collective leaf structure;cotyledon;flower;flower pedicel;guard cell;hypocotyl;inflorescence meristem;leaf apex;leaf lamina base;petal;petiole;plant embryo;pollen;root;seed;sepal;shoot apex;shoot system;stamen;stem;vascular leaf,
Locus:2097945	AT3G47980	protein_coding	Integral membrane HPP family protein. Putative nitrate transporter.	ATNITR2;2	chloroplast;molecular_function;guard cell;root,
Locus:2042937	AT2G38100	protein_coding	Encodes a nitrate transporter that is involved in nitrogen accumulation in embryos.	NPF5.5	dipeptide transport;nitrate transmembrane transport;dipeptide transport;transmembrane transport;membrane;extracellular region;amino acid transmembrane transporter activity;dipeptide transmembrane transporter activity;transmembrane transporter activity;uracil transmembrane transporter activity;LP.06 six leaves visible stage;LP.08 eight leaves visible stage;LP.10 ten leaves visible stage;LP.12 twelve leaves visible stage;flowering stage;cotyledon;flower;flower pedicel;hypocotyl;plant embryo;plant sperm cell;root;sepal;shoot apex;shoot system;stem;vascular leaf,
Locus:2085647	AT3G45650	protein_coding	Encodes a nitrate efflux transporter NAXT1 (for NITRATE EXCRETION TRANSPORTER1).  Localized to the plasma membrane.  NAXT1 belongs to a subclass of seven NAXT members from the large NITRATE TRANSPORTER1/PEPTIDE TRANSPORTER family and is mainly expressed in the cortex of mature roots.	ATNPF2.7;NAXT1;NITRATE EXCRETION TRANSPORTER1;NPF2.7;NRT1/ PTR FAMILY 2.7	nitrate transmembrane transport;response to acidic pH;transmembrane transport;plasma membrane;nucleus;plasma membrane;nitrate efflux transmembrane transporter activity;transmembrane transporter activity;guard cell;root cortex,
